Column Name,Data Type,Format / Unit,Required,Description,Example Value,Validation Rules,Source / Derivation
timestamp_utc,Datetime string,"ISO 8601, UTC",Yes,UTC date and time at which the RTT probe observation was recorded.,2026-07-08T16:59:12.695+00:00,Must be a valid ISO 8601 timestamp with UTC offset; must fall within the documented collection interval.,Derived directly from the raw ts_iso field.
source_region,String,AWS region identifier,Yes,AWS region containing the node that generated the RTT measurement.,ap-northeast-1,"Allowed values: us-east-1, us-west-2, eu-west-1, ap-northeast-1, ap-south-1.",Derived from the parent directory of the original source-node log.
source_node,String,Anonymous node identifier,Yes,Stable anonymized identifier representing the source measurement node.,node_a1b2c3d4e5f6,Must begin with 'node_' and remain consistent for the same source node throughout the dataset.,Generated by applying a stable one-way hash to the original source-node identifier.
destination_region,String,AWS region identifier,Yes,AWS region containing the destination peer to which the RTT probe was sent.,us-west-2,"Allowed values: us-east-1, us-west-2, eu-west-1, ap-northeast-1, ap-south-1.",Renamed from the raw peer_region field.
destination_node,String,Anonymous node identifier,Yes,Stable anonymized identifier representing the destination peer node.,node_f6e5d4c3b2a1,Must begin with 'node_' and remain consistent for the same destination node throughout the dataset.,Generated by applying a stable one-way hash to the original peer IP address.
sequence_number,Integer,Unitless,Yes,Probe sequence number assigned by the measurement process; useful for reconstructing probe order and detecting missing observations.,7,Must be an integer greater than or equal to zero; repeated values may occur across different source nodes.,Renamed from the raw seq field.
rtt_microseconds,Integer,Microseconds (µs),Yes,Original measured round-trip time between the source and destination nodes.,97383,"Must be numeric, non-negative, and represent the original measurement precision.",Renamed from the raw rtt_us field.
rtt_milliseconds,Floating point,Milliseconds (ms),Yes,Round-trip time converted to milliseconds for convenient statistical analysis and visualization.,97.383,Must equal rtt_microseconds / 1000; must be non-negative.,Calculated as rtt_microseconds divided by 1000.
